[
  {
    "tag": "aa",
    "englishName": "Afar",
    "nativeName": "Qafar",
    "script": "Latn",
    "direction": "ltr",
    "family": "latin-qwerty",
    "implemented": false,
    "validated": false,
    "availableForDownload": false,
    "status": "catalog-only",
    "packVersion": null,
    "minAppVersion": null,
    "layoutType": null,
    "inputMethod": null,
    "sizeBytes": null,
    "sha256": null,
    "path": null
  },
  {
    "tag": "ab",
    "englishName": "Abkhaz",
    "nativeName": "Аҧсуа",
    "script": "Cyrl",
    "direction": "ltr",
    "family": "cyrillic",
    "implemented": false,
    "validated": false,
    "availableForDownload": false,
    "status": "catalog-only",
    "packVersion": null,
    "minAppVersion": null,
    "layoutType": null,
    "inputMethod": null,
    "sizeBytes": null,
    "sha256": null,
    "path": null
  },
  {
    "tag": "acm",
    "englishName": "Mesopotamian Arabic",
    "nativeName": "عراقي",
    "script": "Arab",
    "direction": "rtl",
    "family": "arabic",
    "implemented": false,
    "validated": false,
    "availableForDownload": false,
    "status": "catalog-only",
    "packVersion": null,
    "minAppVersion": null,
    "layoutType": null,
    "inputMethod": null,
    "sizeBytes": null,
    "sha256": null,
    "path": null
  },
  {
    "tag": "ady",
    "englishName": "Adyghe",
    "nativeName": "Адыгабзэ",
    "script": "Cyrl",
    "direction": "ltr",
    "family": "cyrillic",
    "implemented": false,
    "validated": false,
    "availableForDownload": false,
    "status": "catalog-only",
    "packVersion": null,
    "minAppVersion": null,
    "layoutType": null,
    "inputMethod": null,
    "sizeBytes": null,
    "sha256": null,
    "path": null
  },
  {
    "tag": "af",
    "englishName": "Afrikaans",
    "nativeName": "Afrikaans",
    "script": "Latn",
    "direction": "ltr",
    "family": "latin-qwerty",
    "implemented": true,
    "validated": true,
    "availableForDownload": true,
    "status": "available",
    "packVersion": "1.0.0",
    "minAppVersion": 6,
    "layoutType": "direct",
    "inputMethod": "direct",
    "sizeBytes": 3893,
    "sha256": "c89acc06f6d17ee026dfe86a8f9face770ac4f71c11d98c155b00f9c38f9537d",
    "path": "packs/af/"
  },
  {
    "tag": "ak",
    "englishName": "Akan",
    "nativeName": "Akan",
    "script": "Latn",
    "direction": "ltr",
    "family": "latin-qwerty",
    "implemented": false,
    "validated": false,
    "availableForDownload": false,
    "status": "catalog-only",
    "packVersion": null,
    "minAppVersion": null,
    "layoutType": null,
    "inputMethod": null,
    "sizeBytes": null,
    "sha256": null,
    "path": null
  },
  {
    "tag": "am",
    "englishName": "Amharic",
    "nativeName": "አማርኛ",
    "script": "Ethi",
    "direction": "ltr",
    "family": "none",
    "implemented": false,
    "validated": false,
    "availableForDownload": false,
    "status": "catalog-only",
    "packVersion": null,
    "minAppVersion": null,
    "layoutType": null,
    "inputMethod": null,
    "sizeBytes": null,
    "sha256": null,
    "path": null
  },
  {
    "tag": "an",
    "englishName": "Aragonese",
    "nativeName": "Aragonés",
    "script": "Latn",
    "direction": "ltr",
    "family": "latin-qwerty",
    "implemented": false,
    "validated": false,
    "availableForDownload": false,
    "status": "catalog-only",
    "packVersion": null,
    "minAppVersion": null,
    "layoutType": null,
    "inputMethod": null,
    "sizeBytes": null,
    "sha256": null,
    "path": null
  },
  {
    "tag": "apc",
    "englishName": "Levantine Arabic",
    "nativeName": "شامي",
    "script": "Arab",
    "direction": "rtl",
    "family": "arabic",
    "implemented": false,
    "validated": false,
    "availableForDownload": false,
    "status": "catalog-only",
    "packVersion": null,
    "minAppVersion": null,
    "layoutType": null,
    "inputMethod": null,
    "sizeBytes": null,
    "sha256": null,
    "path": null
  },
  {
    "tag": "ar",
    "englishName": "Arabic",
    "nativeName": "العربية",
    "script": "Arab",
    "direction": "rtl",
    "family": "arabic",
    "implemented": true,
    "validated": true,
    "availableForDownload": true,
    "status": "available",
    "packVersion": "1.0.0",
    "minAppVersion": 6,
    "layoutType": "direct",
    "inputMethod": "direct",
    "sizeBytes": 3911,
    "sha256": "2572f52ec30d79f23ca980731558e3d9671cb1d783694ece3beb92ea217616d7",
    "path": "packs/ar/"
  },
  {
    "tag": "ar-EG",
    "englishName": "Arabic (Egypt)",
    "nativeName": "العربية (مصر)",
    "script": "Arab",
    "direction": "rtl",
    "family": "arabic",
    "implemented": false,
    "validated": false,
    "availableForDownload": false,
    "status": "catalog-only",
    "packVersion": null,
    "minAppVersion": null,
    "layoutType": null,
    "inputMethod": null,
    "sizeBytes": null,
    "sha256": null,
    "path": null
  },
  {
    "tag": "arn",
    "englishName": "Mapudungun",
    "nativeName": "Mapudungun",
    "script": "Latn",
    "direction": "ltr",
    "family": "latin-qwerty",
    "implemented": false,
    "validated": false,
    "availableForDownload": false,
    "status": "catalog-only",
    "packVersion": null,
    "minAppVersion": null,
    "layoutType": null,
    "inputMethod": null,
    "sizeBytes": null,
    "sha256": null,
    "path": null
  },
  {
    "tag": "ary",
    "englishName": "Moroccan Arabic",
    "nativeName": "الدارجة",
    "script": "Arab",
    "direction": "rtl",
    "family": "arabic",
    "implemented": false,
    "validated": false,
    "availableForDownload": false,
    "status": "catalog-only",
    "packVersion": null,
    "minAppVersion": null,
    "layoutType": null,
    "inputMethod": null,
    "sizeBytes": null,
    "sha256": null,
    "path": null
  },
  {
    "tag": "arz",
    "englishName": "Egyptian Arabic",
    "nativeName": "مصرى",
    "script": "Arab",
    "direction": "rtl",
    "family": "arabic",
    "implemented": false,
    "validated": false,
    "availableForDownload": false,
    "status": "catalog-only",
    "packVersion": null,
    "minAppVersion": null,
    "layoutType": null,
    "inputMethod": null,
    "sizeBytes": null,
    "sha256": null,
    "path": null
  },
  {
    "tag": "as",
    "englishName": "Assamese",
    "nativeName": "অসমীয়া",
    "script": "Beng",
    "direction": "ltr",
    "family": "bengali",
    "implemented": true,
    "validated": true,
    "availableForDownload": true,
    "status": "available",
    "packVersion": "1.0.0",
    "minAppVersion": 6,
    "layoutType": "complex",
    "inputMethod": "direct",
    "sizeBytes": 3672,
    "sha256": "c2a0b161dab1d9b2a918c35fa206f78c330e0effbb4ab11135bcada819e3ad96",
    "path": "packs/as/"
  },
  {
    "tag": "ast",
    "englishName": "Asturian",
    "nativeName": "Asturianu",
    "script": "Latn",
    "direction": "ltr",
    "family": "latin-qwerty",
    "implemented": false,
    "validated": false,
    "availableForDownload": false,
    "status": "catalog-only",
    "packVersion": null,
    "minAppVersion": null,
    "layoutType": null,
    "inputMethod": null,
    "sizeBytes": null,
    "sha256": null,
    "path": null
  },
  {
    "tag": "av",
    "englishName": "Avar",
    "nativeName": "Авар",
    "script": "Cyrl",
    "direction": "ltr",
    "family": "cyrillic",
    "implemented": false,
    "validated": false,
    "availableForDownload": false,
    "status": "catalog-only",
    "packVersion": null,
    "minAppVersion": null,
    "layoutType": null,
    "inputMethod": null,
    "sizeBytes": null,
    "sha256": null,
    "path": null
  },
  {
    "tag": "ay",
    "englishName": "Aymara",
    "nativeName": "Aymar aru",
    "script": "Latn",
    "direction": "ltr",
    "family": "latin-qwerty",
    "implemented": false,
    "validated": false,
    "availableForDownload": false,
    "status": "catalog-only",
    "packVersion": null,
    "minAppVersion": null,
    "layoutType": null,
    "inputMethod": null,
    "sizeBytes": null,
    "sha256": null,
    "path": null
  },
  {
    "tag": "az",
    "englishName": "Azerbaijani",
    "nativeName": "Azərbaycan",
    "script": "Latn",
    "direction": "ltr",
    "family": "latin-qwerty",
    "implemented": true,
    "validated": true,
    "availableForDownload": true,
    "status": "available",
    "packVersion": "1.0.0",
    "minAppVersion": 6,
    "layoutType": "direct",
    "inputMethod": "direct",
    "sizeBytes": 3957,
    "sha256": "c6c703f47fa7dc2a9b53c97d30feaf13ec5013da57cefb77319b5a5873f71a5a",
    "path": "packs/az/"
  },
  {
    "tag": "ba",
    "englishName": "Bashkir",
    "nativeName": "Башҡорт",
    "script": "Cyrl",
    "direction": "ltr",
    "family": "cyrillic",
    "implemented": false,
    "validated": false,
    "availableForDownload": false,
    "status": "catalog-only",
    "packVersion": null,
    "minAppVersion": null,
    "layoutType": null,
    "inputMethod": null,
    "sizeBytes": null,
    "sha256": null,
    "path": null
  },
  {
    "tag": "bal",
    "englishName": "Balochi",
    "nativeName": "بلۏچی",
    "script": "Arab",
    "direction": "rtl",
    "family": "arabic",
    "implemented": false,
    "validated": false,
    "availableForDownload": false,
    "status": "catalog-only",
    "packVersion": null,
    "minAppVersion": null,
    "layoutType": null,
    "inputMethod": null,
    "sizeBytes": null,
    "sha256": null,
    "path": null
  },
  {
    "tag": "bar",
    "englishName": "Bavarian",
    "nativeName": "Boarisch",
    "script": "Latn",
    "direction": "ltr",
    "family": "latin-qwertz",
    "implemented": false,
    "validated": false,
    "availableForDownload": false,
    "status": "catalog-only",
    "packVersion": null,
    "minAppVersion": null,
    "layoutType": null,
    "inputMethod": null,
    "sizeBytes": null,
    "sha256": null,
    "path": null
  },
  {
    "tag": "be",
    "englishName": "Belarusian",
    "nativeName": "Беларуская",
    "script": "Cyrl",